{
  "id": "tutor-character.canonical.jana-speaking-open",
  "title": "Jana, speaking, open mouth",
  "component": "TutorCharacter",
  "note": "The Jana character speaking with the open mouth shape of DSN-27's four (picked from loudness in S3).",
  "state": "canonical",
  "payload": {
    "character": "avatar.jana",
    "pose": "speaking",
    "mouth": "open"
  },
  "payloadContract": null,
  "context": {
    "theme": "light"
  },
  "placements": [
    "page"
  ],
  "variant": "jana-speaking-open"
}
