{
  "component": "VisualViewer",
  "context": {
    "theme": "light"
  },
  "id": "visual-viewer.canonical.statistics-histogram",
  "payload": {
    "alt": {
      "locale": "en",
      "steps": [],
      "summary": "A histogram of 3 classes: 0 to 10: 4, 10 to 30: 12 and 30 to 40: 6."
    },
    "computed": {},
    "fallback_reason": null,
    "labels": "shown",
    "numbers_from": [
      "kn_c1",
      "kn_c2",
      "kn_c3",
      "kn_b0",
      "kn_b10",
      "kn_b30",
      "kn_b40"
    ],
    "params": {
      "chart": "histogram",
      "classes": [
        {
          "frequency": "4",
          "id": "c1",
          "lower": "0",
          "upper": "10"
        },
        {
          "frequency": "12",
          "id": "c2",
          "lower": "10",
          "upper": "30"
        },
        {
          "frequency": "6",
          "id": "c3",
          "lower": "30",
          "upper": "40"
        }
      ]
    },
    "parts": [
      {
        "focusable": true,
        "id": "c1",
        "name": "class 0 to 10",
        "role": "region"
      },
      {
        "focusable": true,
        "id": "c2",
        "name": "class 10 to 30",
        "role": "region"
      },
      {
        "focusable": true,
        "id": "c3",
        "name": "class 30 to 40",
        "role": "region"
      }
    ],
    "repairs": [],
    "resolution_hash": "sha256:349fb9ebf447d6912f632793ff5b3a582773951c138f3a9043dd1ca6788a7f52",
    "spec_version": 1,
    "status": "ok",
    "steps": [],
    "type": "statistics_chart",
    "visual_id": "vis_MZSBM7PHF37KZVTR7KNWKFTG3X"
  },
  "payloadContract": "https://jana.dev/contracts/visuals/visual-spec#/$defs/resolved",
  "placements": [
    "conversation"
  ],
  "state": "canonical",
  "title": "Visual: statistics histogram (shown labels)",
  "variant": "statistics-histogram"
}
