{
  "id": "home-plan.canonical.keep-learning",
  "title": "Home: Next up",
  "component": "HomePlan",
  "note": "The fresh plan after a finished one: its start reads Keep learning (LRN-31).",
  "state": "canonical",
  "variant": "keep-learning",
  "payload": {
    "plan": {
      "status": "ready",
      "plan": {
        "plan_id": "01J9ZZPLANFIXTURE000000001",
        "request_id": "req_01J9ZZPLANFIXTURE000000001",
        "date": "2026-10-17",
        "phase": "normal",
        "status": "proposed",
        "minutes": 31,
        "blocks": [
          {
            "index": 0,
            "kind": "warmup",
            "kc_ids": [
              "kc.phy.o.motion.speed",
              "kc.phy.o.motion.velocity"
            ],
            "minutes": 5,
            "status": "pending",
            "done": 0,
            "target": 2
          },
          {
            "index": 1,
            "kind": "main",
            "kc_ids": [
              "kc.phy.o.forces.newton_second"
            ],
            "minutes": 20,
            "status": "pending",
            "done": 0,
            "target": 1
          },
          {
            "index": 2,
            "kind": "mixed",
            "kc_ids": [
              "kc.phy.o.motion.speed"
            ],
            "minutes": 5,
            "status": "pending",
            "done": 0,
            "target": 1
          },
          {
            "index": 3,
            "kind": "reflect",
            "kc_ids": [],
            "minutes": 1,
            "status": "pending",
            "done": 0,
            "target": 0
          }
        ],
        "next_block": 0,
        "alternatives": [
          {
            "kind": "main",
            "kc_ids": [
              "kc.phy.o.forces.mass_weight"
            ],
            "minutes": 20
          },
          {
            "kind": "main",
            "kc_ids": [
              "kc.phy.o.energy.kinetic"
            ],
            "minutes": 20
          },
          {
            "kind": "main",
            "kc_ids": [
              "kc.phy.o.motion.acceleration"
            ],
            "minutes": 20
          }
        ],
        "keep_learning": true,
        "decided_ts": null,
        "card": {
          "card_type": "plan",
          "title": "Keep learning",
          "actions": [
            "start",
            "change"
          ],
          "items": [
            {
              "id": "b0",
              "text": "warmup",
              "status": "pending"
            },
            {
              "id": "b1",
              "text": "main",
              "status": "pending"
            },
            {
              "id": "b2",
              "text": "mixed",
              "status": "pending"
            },
            {
              "id": "b3",
              "text": "reflect",
              "status": "pending"
            }
          ]
        }
      },
      "busy": false,
      "actionFailed": false
    },
    "streak": {
      "days": 5,
      "freezes": 1
    },
    "topics": {
      "kc.phy.o.motion.speed": "Speed and velocity",
      "kc.phy.o.motion.velocity": "Speed and velocity",
      "kc.phy.o.forces.newton_second": "Force and acceleration",
      "kc.phy.o.forces.mass_weight": "Mass and weight",
      "kc.phy.o.energy.kinetic": "Kinetic energy",
      "kc.phy.o.motion.acceleration": "Acceleration"
    },
    "started": []
  },
  "payloadContract": null,
  "context": {
    "theme": "light"
  },
  "placements": [
    "page"
  ],
  "expectText": [
    "Keep learning",
    "Warm-up: 2 reviews"
  ]
}
