{
  "id": "tutor-character.canonical.prism-interrupted",
  "title": "Prism, interrupted",
  "component": "TutorCharacter",
  "note": "The Prism character (DSN-26) in the interrupted pose of TABLE DSN-26b, on the shared rig; no frown, no outline, no halo.",
  "state": "canonical",
  "payload": {
    "character": "avatar.prism",
    "pose": "interrupted"
  },
  "payloadContract": null,
  "context": {
    "theme": "light"
  },
  "placements": [
    "page"
  ],
  "variant": "prism-interrupted"
}
