{
  "id": "past-papers.loading",
  "title": "Past papers loading",
  "component": "PastPapers",
  "note": "The papers are being read.",
  "state": "loading",
  "payload": {
    "view": {
      "status": "loading",
      "papers": [],
      "sources": [
        {
          "sourceId": "src_01JABCDEFGHJKMNPQRSTVW12",
          "revision": 1,
          "title": "Physics paper 2, practice set",
          "private": false
        },
        {
          "sourceId": "src_01JABCDEFGHJKMNPQRSTVW13",
          "revision": 1,
          "title": null,
          "private": true
        }
      ],
      "importing": false,
      "refused": null,
      "imported": null
    },
    "subjects": [
      {
        "subject": "physics",
        "label": "Physics"
      },
      {
        "subject": "mathematics",
        "label": "Mathematics"
      }
    ]
  },
  "payloadContract": null,
  "context": {
    "theme": "light"
  },
  "placements": [
    "page"
  ],
  "expectText": [
    "Your past papers"
  ]
}
