{
  "id": "mock-sitting.canonical.paused",
  "title": "Mock sitting, paused",
  "component": "MockSitting",
  "note": "Paused (TABLE UXS-25a paused): the clock stops, the paper is hidden and the pause time left is named.",
  "state": "canonical",
  "variant": "paused",
  "payload": {
    "view": {
      "papers": [
        {
          "paper_id": "mck.phy.o.0001",
          "subject": "physics",
          "level": "O",
          "title": "Physics mock, objective paper, set 1",
          "paper_kind": "paper_1_objective",
          "duration_minutes": 60,
          "total_marks": 5,
          "questions": 4,
          "calculator": true
        }
      ],
      "exam": {
        "exam_id": "exm_01JABCDEFGHJKMNPQRSTVWXYZ0",
        "paper_id": "mck.phy.o.0001",
        "state": "paused",
        "questions": [
          {
            "item_id": "itm.phy.o.motion.0901",
            "pack_id": "pack.phy.o",
            "pack_version": "1.0.1",
            "kc_ids": [
              "kc.phy.o.motion.average_speed"
            ],
            "kind": "mcq",
            "stem": "A cyclist rides 120 m in 30 s at a steady speed. What is the cyclist's speed?",
            "parts": [
              {
                "part_id": "a",
                "prompt": "A cyclist rides 120 m in 30 s at a steady speed. What is the cyclist's speed?",
                "marks": 1,
                "uses_parts": [],
                "input": {
                  "kind": "mcq",
                  "options": [
                    {
                      "id": "o0",
                      "label": "0.25 m/s"
                    },
                    {
                      "id": "o1",
                      "label": "4.0 m/s"
                    },
                    {
                      "id": "o2",
                      "label": "90 m/s"
                    },
                    {
                      "id": "o3",
                      "label": "3600 m/s"
                    }
                  ]
                }
              }
            ],
            "visual": null,
            "marks": 1
          },
          {
            "item_id": "itm.phy.o.motion.0902",
            "pack_id": "pack.phy.o",
            "pack_version": "1.0.1",
            "kc_ids": [
              "kc.phy.o.motion.distance_or_displacement"
            ],
            "kind": "mcq",
            "stem": "Which quantity is a vector?",
            "parts": [
              {
                "part_id": "a",
                "prompt": "Which quantity is a vector?",
                "marks": 1,
                "uses_parts": [],
                "input": {
                  "kind": "mcq",
                  "options": [
                    {
                      "id": "o0",
                      "label": "Distance"
                    },
                    {
                      "id": "o1",
                      "label": "Speed"
                    },
                    {
                      "id": "o2",
                      "label": "Displacement"
                    },
                    {
                      "id": "o3",
                      "label": "Time"
                    }
                  ]
                }
              }
            ],
            "visual": null,
            "marks": 1
          },
          {
            "item_id": "itm.phy.o.motion.0903",
            "pack_id": "pack.phy.o",
            "pack_version": "1.0.1",
            "kc_ids": [
              "kc.phy.o.motion.acceleration_from_change"
            ],
            "kind": "numeric",
            "stem": "A trolley speeds up from rest to 6.0 m/s in 3.0 s.",
            "parts": [
              {
                "part_id": "a",
                "prompt": "Calculate its acceleration.",
                "marks": 2,
                "uses_parts": [],
                "input": {
                  "kind": "numeric",
                  "unit_prompt": null
                }
              }
            ],
            "visual": null,
            "marks": 2
          },
          {
            "item_id": "itm.phy.o.motion.0904",
            "pack_id": "pack.phy.o",
            "pack_version": "1.0.1",
            "kc_ids": [
              "kc.phy.o.motion.speed_unit_conversion"
            ],
            "kind": "mcq",
            "stem": "A ball is thrown straight up. At the top of its path, what is its speed?",
            "parts": [
              {
                "part_id": "a",
                "prompt": "A ball is thrown straight up. At the top of its path, what is its speed?",
                "marks": 1,
                "uses_parts": [],
                "input": {
                  "kind": "mcq",
                  "options": [
                    {
                      "id": "o0",
                      "label": "Zero"
                    },
                    {
                      "id": "o1",
                      "label": "Half the launch speed"
                    },
                    {
                      "id": "o2",
                      "label": "The launch speed"
                    },
                    {
                      "id": "o3",
                      "label": "Twice the launch speed"
                    }
                  ]
                }
              }
            ],
            "visual": null,
            "marks": 1
          }
        ],
        "answers": {
          "1": {
            "answer": {
              "parts": [
                {
                  "part_id": "a",
                  "kind": "mcq",
                  "option_id": "o1"
                }
              ]
            },
            "flagged": false
          }
        },
        "duration_ms": 3600000,
        "remaining_ms": 2465000,
        "pauses": [
          {
            "at": "2026-10-15T09:20:00.000Z",
            "length_ms": 180000
          }
        ],
        "interruptions": [],
        "running_deadline_ts": null,
        "extra_time_percent": 0,
        "calculator": true,
        "question_ids": [
          "1",
          "2",
          "3",
          "4"
        ]
      }
    },
    "subjects": [
      {
        "subject": "mathematics",
        "label": "Mathematics"
      },
      {
        "subject": "physics",
        "label": "Physics"
      }
    ],
    "names": {
      "topics": {
        "cur.phy.o.motion_forces_and_energy": "Motion, forces and energy",
        "cur.phy.o.waves": "Waves"
      },
      "kcs": {
        "kc.phy.o.motion.distance_or_displacement": "Tell distance from displacement",
        "kc.phy.o.motion.acceleration_from_change": "Find acceleration from a change in velocity",
        "kc.phy.o.motion.average_speed": "Work out average speed"
      }
    }
  },
  "payloadContract": null,
  "context": {
    "theme": "light"
  },
  "placements": [
    "page"
  ],
  "expectText": [
    "Paused. 7 minutes of pause time left.",
    "Continue"
  ]
}
