{
  "component": "VisualViewer",
  "context": {
    "theme": "light"
  },
  "id": "visual-viewer.canonical.ray-magnifier",
  "payload": {
    "alt": {
      "locale": "en",
      "steps": [],
      "summary": "A ray diagram for a converging lens: object 5 cm from the optic, image 10 cm from the optic, virtual upright magnified, magnification 2."
    },
    "computed": {
      "check_ids": [
        "chk_build_fx_ray_magnifier_1"
      ],
      "focal_points": [
        [
          -10.0,
          0.0
        ],
        [
          10.0,
          0.0
        ]
      ],
      "image_top": [
        -10.0,
        4.0
      ],
      "labels": {
        "image_distance": "10 cm",
        "magnification": "2"
      },
      "nature": {
        "orientation": "upright",
        "size": "magnified",
        "type": "virtual"
      },
      "nature_text": "virtual upright magnified",
      "object_top": [
        -5.0,
        2.0
      ],
      "paths": {
        "centre": [
          [
            -5.0,
            2.0
          ],
          [
            0.0,
            0.0
          ],
          [
            20.0,
            -8.0
          ]
        ],
        "parallel": [
          [
            -5.0,
            2.0
          ],
          [
            0.0,
            2.0
          ],
          [
            20.0,
            -2.0
          ]
        ]
      },
      "rays": [
        "parallel",
        "centre"
      ]
    },
    "fallback_reason": null,
    "labels": "shown",
    "numbers_from": [
      "chk_build_fx_ray_magnifier_1",
      "pack:pack.phy.o/visual_presets/dgm.phy.ray_converging_inside_f.v1"
    ],
    "params": {
      "focal_length": "10 cm",
      "object_distance": "5 cm",
      "object_height": "2 cm",
      "optic": "converging_lens",
      "rays": [
        "parallel",
        "centre"
      ],
      "show": [
        "image",
        "focal_points",
        "virtual_extensions"
      ]
    },
    "parts": [
      {
        "focusable": true,
        "id": "optic",
        "name": "converging lens",
        "role": "line"
      },
      {
        "focusable": false,
        "id": "principal_axis",
        "name": "principal axis",
        "role": "line"
      },
      {
        "focusable": true,
        "id": "object",
        "name": "object",
        "quizzable": true,
        "role": "point"
      },
      {
        "focusable": true,
        "id": "image",
        "name": "image",
        "quizzable": true,
        "role": "point"
      },
      {
        "focusable": true,
        "id": "F1",
        "name": "focal point F",
        "role": "point"
      },
      {
        "focusable": true,
        "id": "F2",
        "name": "focal point F",
        "role": "point"
      },
      {
        "focusable": true,
        "id": "ray.parallel",
        "name": "parallel ray",
        "role": "ray"
      },
      {
        "focusable": true,
        "id": "ray.centre",
        "name": "centre ray",
        "role": "ray"
      }
    ],
    "ref": "dgm.phy.ray_converging_inside_f.v1",
    "repairs": [],
    "resolution_hash": "sha256:8fa2285671910533bf78f89675d803c358843d30257143a8b5ba2fda05c33a19",
    "spec_version": 1,
    "status": "ok",
    "steps": [],
    "type": "ray_diagram",
    "visual_id": "vis_F28PHH5KZRRPNR33R4XG5H38NT"
  },
  "payloadContract": "https://jana.dev/contracts/visuals/visual-spec#/$defs/resolved",
  "placements": [
    "conversation"
  ],
  "state": "canonical",
  "title": "Visual: ray magnifier (shown labels)",
  "variant": "ray-magnifier"
}
