{
  "component": "VisualViewer",
  "context": {
    "theme": "light"
  },
  "id": "visual-viewer.canonical.distribution-curve-binomial",
  "payload": {
    "alt": {
      "locale": "en",
      "steps": [],
      "summary": "A binomial distribution with n = 20 and p = 0.3, with P(X ≤ 4) shaded: the probability is 0.2375."
    },
    "computed": {
      "bars": [
        [
          0,
          0.000797923
        ],
        [
          1,
          0.00683934
        ],
        [
          2,
          0.0278459
        ],
        [
          3,
          0.0716037
        ],
        [
          4,
          0.130421
        ],
        [
          5,
          0.178863
        ],
        [
          6,
          0.191639
        ],
        [
          7,
          0.164262
        ],
        [
          8,
          0.114397
        ],
        [
          9,
          0.0653696
        ],
        [
          10,
          0.0308171
        ],
        [
          11,
          0.0120067
        ],
        [
          12,
          0.00385928
        ],
        [
          13,
          0.00101783
        ],
        [
          14,
          0.000218107
        ],
        [
          15,
          3.73898e-05
        ]
      ],
      "check_ids": [
        "chk_build_fx_distribution_curve_binomial_1",
        "chk_build_fx_distribution_curve_binomial_2",
        "chk_build_fx_distribution_curve_binomial_3",
        "chk_build_fx_distribution_curve_binomial_4",
        "chk_build_fx_distribution_curve_binomial_5",
        "chk_build_fx_distribution_curve_binomial_6",
        "chk_build_fx_distribution_curve_binomial_7",
        "chk_build_fx_distribution_curve_binomial_8",
        "chk_build_fx_distribution_curve_binomial_9",
        "chk_build_fx_distribution_curve_binomial_10",
        "chk_build_fx_distribution_curve_binomial_11",
        "chk_build_fx_distribution_curve_binomial_12",
        "chk_build_fx_distribution_curve_binomial_13",
        "chk_build_fx_distribution_curve_binomial_14",
        "chk_build_fx_distribution_curve_binomial_15",
        "chk_build_fx_distribution_curve_binomial_16",
        "chk_build_fx_distribution_curve_binomial_17"
      ],
      "event": "P(X ≤ 4)",
      "labels": {
        "shade": "0.2375"
      },
      "shade": [
        0,
        4
      ]
    },
    "fallback_reason": null,
    "labels": "shown",
    "numbers_from": [
      "chk_build_fx_distribution_curve_binomial_1",
      "chk_build_fx_distribution_curve_binomial_2",
      "chk_build_fx_distribution_curve_binomial_3",
      "chk_build_fx_distribution_curve_binomial_4",
      "chk_build_fx_distribution_curve_binomial_5",
      "chk_build_fx_distribution_curve_binomial_6",
      "chk_build_fx_distribution_curve_binomial_7",
      "chk_build_fx_distribution_curve_binomial_8",
      "chk_build_fx_distribution_curve_binomial_9",
      "chk_build_fx_distribution_curve_binomial_10",
      "chk_build_fx_distribution_curve_binomial_11",
      "chk_build_fx_distribution_curve_binomial_12",
      "chk_build_fx_distribution_curve_binomial_13",
      "chk_build_fx_distribution_curve_binomial_14",
      "chk_build_fx_distribution_curve_binomial_15",
      "chk_build_fx_distribution_curve_binomial_16",
      "chk_build_fx_distribution_curve_binomial_17"
    ],
    "params": {
      "distribution": "binomial",
      "interval": [
        0,
        4
      ],
      "parameters": {
        "n": 20,
        "p": 0.3
      },
      "tail": "less_than"
    },
    "parts": [
      {
        "focusable": true,
        "id": "curve",
        "name": "binomial distribution",
        "role": "curve"
      },
      {
        "focusable": true,
        "id": "shade",
        "name": "shaded probability P(X ≤ 4)",
        "quizzable": true,
        "role": "region"
      },
      {
        "focusable": true,
        "id": "mean",
        "name": "mean",
        "role": "line"
      }
    ],
    "repairs": [],
    "resolution_hash": "sha256:a8e01e4c9791a1c1433370ed92b589c585a042e77fdd92d1f36f5fc099e0d53d",
    "spec_version": 1,
    "status": "ok",
    "steps": [],
    "type": "distribution_curve",
    "visual_id": "vis_80YCQH113KGDJN955027ZXJHKF"
  },
  "payloadContract": "https://jana.dev/contracts/visuals/visual-spec#/$defs/resolved",
  "placements": [
    "conversation"
  ],
  "state": "canonical",
  "title": "Visual: distribution curve binomial (shown labels)",
  "variant": "distribution-curve-binomial"
}
