{
  "id": "saved-questions.canonical.resolved-light",
  "title": "Saved questions resolved",
  "component": "SavedQuestions",
  "state": "canonical",
  "variant": "resolved",
  "payload": {
    "view": {
      "status": "ready",
      "questions": [
        {
          "question_id": "00000000000000000000000090",
          "session_id": "ses_00000000000000000000000001",
          "status": "sorted",
          "expires_at": "2027-01-17T00:00:00Z",
          "snapshot": {
            "kind": "saved_question",
            "question_id": "00000000000000000000000090",
            "subject": "physics",
            "topic_id": "cur.phy.o.motion",
            "problem": "Find the speed of a cyclist who covers 20 metres in 4 seconds.",
            "board": [
              {
                "latex": "v=20/4",
                "reason": "Divide distance by time"
              }
            ],
            "reason": "student_requested",
            "created_at": "2026-10-17T00:00:00Z"
          }
        }
      ],
      "selected": "00000000000000000000000090",
      "busy": false,
      "error": false,
      "uncertain": false,
      "saved": null
    }
  },
  "payloadContract": null,
  "context": {
    "theme": "light"
  },
  "placements": [
    "page"
  ],
  "expectText": [
    "Saved questions"
  ]
}
