{
  "component": "VisualViewer",
  "context": {
    "theme": "light"
  },
  "id": "visual-viewer.canonical.energy-profile",
  "payload": {
    "alt": {
      "locale": "en",
      "steps": [],
      "summary": "An energy profile for an exothermic reaction from CH4 + 2O2 to CO2 + 2H2O; activation energy 250 kJ/mol; enthalpy change -890 kJ/mol."
    },
    "computed": {},
    "fallback_reason": null,
    "labels": "shown",
    "numbers_from": [
      "kn_ea",
      "kn_dh"
    ],
    "params": {
      "activation_energy": "250 kJ/mol",
      "catalysed": true,
      "enthalpy_change": "-890 kJ/mol",
      "products": "CO2 + 2H2O",
      "reactants": "CH4 + 2O2",
      "reaction": "exothermic"
    },
    "parts": [
      {
        "focusable": true,
        "id": "reactants",
        "name": "reactants",
        "quizzable": true,
        "role": "label"
      },
      {
        "focusable": true,
        "id": "products",
        "name": "products",
        "quizzable": true,
        "role": "label"
      },
      {
        "focusable": true,
        "id": "path",
        "name": "reaction path",
        "role": "curve"
      },
      {
        "focusable": true,
        "id": "activation_energy",
        "name": "activation energy",
        "quizzable": true,
        "role": "label"
      },
      {
        "focusable": true,
        "id": "enthalpy_change",
        "name": "enthalpy change",
        "quizzable": true,
        "role": "label"
      },
      {
        "focusable": true,
        "id": "catalysed_path",
        "name": "catalysed path",
        "role": "curve"
      }
    ],
    "repairs": [],
    "resolution_hash": "sha256:0a0c677f46d464a338f215ed256f9345d5a42748b6e06ea12e5dec5dbec54791",
    "spec_version": 1,
    "status": "ok",
    "steps": [],
    "type": "energy_profile",
    "visual_id": "vis_AC7Z6M43RJND5FK5N478P0E1EX"
  },
  "payloadContract": "https://jana.dev/contracts/visuals/visual-spec#/$defs/resolved",
  "placements": [
    "conversation"
  ],
  "state": "canonical",
  "title": "Visual: energy profile (shown labels)",
  "variant": "energy-profile"
}
