{
  "id": "tutor-character.canonical.ray-speaking-closed",
  "title": "Remy, speaking, closed mouth",
  "component": "TutorCharacter",
  "note": "The Remy character speaking with the closed mouth shape of DSN-27's four (picked from loudness in S3).",
  "state": "canonical",
  "payload": {
    "character": "avatar.ray",
    "pose": "speaking",
    "mouth": "closed"
  },
  "payloadContract": null,
  "context": {
    "theme": "light"
  },
  "placements": [
    "page"
  ],
  "variant": "ray-speaking-closed"
}
