{
  "id": "egress-notice.canonical.telemetry",
  "title": "Pre-send notice, usage reports",
  "note": "Before a usage report is sent. Names the destination and the data in plain words (PRV-28).",
  "component": "EgressNotice",
  "state": "canonical",
  "variant": "telemetry",
  "payload": {
    "path": "telemetry",
    "destination_label": "Usage reports",
    "data_classes": []
  },
  "payloadContract": null,
  "context": {
    "theme": "light"
  },
  "placements": [
    "overlay"
  ]
}
