{
  "id": "assessment.canonical.diagnostic-intro-dark-1",
  "title": "diagnostic intro dark",
  "component": "Assessment",
  "state": "canonical",
  "variant": "diagnostic-intro",
  "payload": {
    "view": {
      "status": "ready",
      "assessments": [],
      "current": null,
      "acting": false,
      "error": null,
      "uncertain": false,
      "saved": false,
      "resumed": false
    }
  },
  "payloadContract": null,
  "context": {
    "theme": "dark",
    "textScale": 1
  },
  "placements": [
    "page"
  ],
  "expectText": []
}
