{
  "id": "left-rail.canonical.student-menu-rail",
  "title": "Student menu open from the rail",
  "component": "LeftRail",
  "note": "The student menu (D115): one row at the sidebar's foot (the avatar alone on the rail) opens it above: the name with subjects and level; Settings with its shortcut, Language, Get help, Keyboard shortcuts; Plan & online features with the plan, Back up this profile; Switch student.",
  "state": "canonical",
  "payload": {
    "places": [
      {
        "id": "home",
        "icon": "home",
        "labelKey": "home.title",
        "current": true
      },
      {
        "id": "learn",
        "icon": "learn",
        "labelKey": "app.learn",
        "current": false
      },
      {
        "id": "practice",
        "icon": "practice",
        "labelKey": "app.practice",
        "current": false
      },
      {
        "id": "notes",
        "icon": "notes",
        "labelKey": "notes.title",
        "current": false
      }
    ],
    "sessions": [
      {
        "group": "today",
        "items": [
          {
            "id": "ses_11111111111111111111111111",
            "title": "Ball thrown up at 14 m/s",
            "subject": "physics",
            "subjectLabel": "Physics",
            "current": false
          },
          {
            "id": "ses_22222222222222222222222222",
            "title": "Moles in 4 g of NaOH",
            "subject": "chemistry",
            "subjectLabel": "Chemistry",
            "current": false
          }
        ]
      },
      {
        "group": "yesterday",
        "items": [
          {
            "id": "ses_33333333333333333333333333",
            "title": "Factorise x^2 + 5x + 6",
            "subject": "mathematics",
            "subjectLabel": "Mathematics",
            "current": false
          }
        ]
      }
    ],
    "profile": {
      "name": "Ada",
      "disc": 1,
      "detail": "Physics, Chemistry · O Level"
    },
    "variant": "rail",
    "menuOpen": true
  },
  "payloadContract": null,
  "context": {
    "theme": "light"
  },
  "placements": [
    "page"
  ],
  "expectText": [
    "Physics, Chemistry · O Level",
    "Settings",
    "Language",
    "Get help",
    "Keyboard shortcuts",
    "Plan & online features",
    "Free (offline)",
    "Back up this profile",
    "Switch student"
  ],
  "variant": "student-menu-rail"
}
