{
  "id": "session-notes.canonical.opened-light-1",
  "title": "Session notes opened",
  "component": "SessionNotes",
  "state": "canonical",
  "variant": "opened",
  "payload": {
    "view": {
      "status": "ready",
      "notes": [
        {
          "note_id": "snt_00000000000000000000000090",
          "session_id": "ses_00000000000000000000000001",
          "kind": "session",
          "title": "Speed and distance",
          "subject": "physics",
          "kc_ids": [
            "kc.phy.o.motion.average_speed"
          ],
          "statements": [
            {
              "section": "method",
              "text": "Divide distance by time.",
              "reference": {
                "session_id": "ses_00000000000000000000000001",
                "turn_id": "trn_00000000000000000000000001",
                "trace_id": null
              }
            }
          ],
          "state": "ready",
          "private": false,
          "source_revision": 1,
          "withheld": 0,
          "created_at": 1792224000000,
          "updated_at": 1792224000000
        }
      ],
      "opened": {
        "note_id": "snt_00000000000000000000000090",
        "session_id": "ses_00000000000000000000000001",
        "kind": "session",
        "title": "Speed and distance",
        "subject": "physics",
        "kc_ids": [
          "kc.phy.o.motion.average_speed"
        ],
        "statements": [
          {
            "section": "method",
            "text": "Divide distance by time.",
            "reference": {
              "session_id": "ses_00000000000000000000000001",
              "turn_id": "trn_00000000000000000000000001",
              "trace_id": null
            }
          }
        ],
        "state": "ready",
        "private": false,
        "source_revision": 1,
        "withheld": 0,
        "created_at": 1792224000000,
        "updated_at": 1792224000000
      },
      "busy": false,
      "error": false,
      "query": ""
    }
  },
  "payloadContract": null,
  "context": {
    "theme": "light",
    "textScale": 1
  },
  "placements": [
    "page"
  ],
  "expectText": []
}
