{
  "id": "tutor-presence.canonical.thinking",
  "title": "Presence, thinking",
  "component": "TutorPresence",
  "note": "The presence (UXS-53) in the thinking voice state: the Prism character in the state's pose with the VOC-04 label beside it (VOC-17).",
  "state": "canonical",
  "payload": {
    "character": "avatar.prism",
    "state": "thinking"
  },
  "payloadContract": null,
  "context": {
    "theme": "light"
  },
  "placements": [
    "page"
  ],
  "variant": "thinking"
}
